shoe_name,url,positive_text,negative_text
Brooks Caldera 6,https://runrepeat.com/brooks-caldera-6,"Enhanced maxed-out protection, excellent grip on dry surfaces, remarkably stable despite its massive height, ideal for heel strikers, perfect for road-to-trail transitions, ultra-comfortable for long runs with DNA Loft v3, lighter compared to the Caldera 5, superb heel support, and extensive upper TPU protection.","Still too heavy, excessively wide platform for technical terrain, and too much exposed foam on the outsole."
Brooks Caldera 7,https://runrepeat.com/brooks-caldera-7,"We think the Caldera 7 is a superb choice for runners who cherish the plush ride of Brooks road shoes with DNA Loft v3 and want a trail option for easy adventures, those new to trail running that want a superbly cushioned shoe, and maximalist shoe fans exploring new alternatives beyond Hokas that seek a stable ride. Tons of cushioning, plush DNA Loft v3 foam, best Caldera to date, superb upper ventilation, surprisingly stable, fairly priced, and can handle ultra races.","Those who favor a firmer midsole would do better in other models, and those who prefer lightweight shoes will not find a pleasant experience here. Still heavy, outsole could be better, and not for technical trails."
Brooks Caldera 8,https://runrepeat.com/brooks-caldera-8,"The Caldera 8 kept the same stable ride and excellent lockdown from previous versions, with dependable grip and a smooth feel, and it works as a small update from version 7 that keeps the same price. Outstanding stability, comfortable smooth ride, versatile on easy and moderate terrain, secure reliable lockdown, fair and reasonable price, dependable traction, and a cleaner more refined look.","The Caldera 8 falls short of the max-stack promise because it offers only moderate cushioning and needs more foam underfoot to truly separate itself inside the Brooks lineup, while also remaining heavy and bulky. Still heavy, needs more cushioning, bulky overly wide heel, and only for slow paces."
Brooks Cascadia 16,https://runrepeat.com/brooks-cascadia-16,"The Brooks Cascadia 16 is ideal for trail runners who want a stiff, protective shoe that is stable on varied terrain. It is amazing for long-distance aggressive runs, protects the feet extremely well, and may be worth checking out for runners on rocky and steep trails whose typical run is under 10 to 15 miles. The shoe also comes with a whole new midsole, updated upper, and nice features like a velcro gaiter attachment on the heel and a lace loop to tuck laces in during runs.","Do not buy the Cascadia 16 if you want a light nimble trail shoe or if you want a soft cushioned shoe for long efforts. The shoe fills a narrow need as a protective stiff shoe, comfort could be better for really long efforts, it runs a bit hot, and at 10.9 ounces it feels too heavy."
Brooks Cascadia 17,https://runrepeat.com/brooks-cascadia-17,"The Cascadia 17 remains a versatile marvel with upgrades like enhanced cushioning, top-notch breathability, and the innovative Trail Adapt system for unrivaled terrain adaptability. Adaptable across various paces, world-class breathability, comfortable for long runs, superior grip thanks to TrailTack Green, environmentally-friendly with recycled materials, excellent stability, rock plate protects the foot, manages technical descents with ease, and ideally designed for heel strikers.","Even though the shoe is magnificent, it feels a bit weighty and its foam may feel slightly firm. Weighs more than v16 and the midsole may feel overly firm for certain users."
Brooks Cascadia 18,https://runrepeat.com/brooks-cascadia-18,"Breathable upper, great value for the price, stability-enhancing Trail Adapt plate, good grip, amazing tongue, doubles well as a hiking shoe, fits most foot shapes, velcro strap for gaiter attachment, and designed with heel strikers in mind.","Noticeable durability issues, midsole lacks bounce and softness, still on the heavier side, and no reflective elements."
Brooks Cascadia 19,https://runrepeat.com/brooks-cascadia-19,"After testing the Cascadia 19, it is a solid choice for long-time Cascadia fans who upgrade every one or two years because this is easily the best version so far, runners seeking a versatile stable and highly durable trail shoe, and hikers or summer trail runners who value plush comfort paired with great ventilation.","The Cascadia 19 is not the best pick for runners who prefer an agile compact-feeling trail shoe because its new ultra-wide midsole makes it feel more bulky than before, and it may disappoint runners seeking deep max-cushioned comfort for long ultras or recovery efforts because the midsole protection level is moderate rather than high."
Brooks Catamount 2,https://runrepeat.com/brooks-catamount-2,"The Brooks Catamount 2 offers a stable ride in a lightweight package and a bouncy DNA Flash midsole with outstanding performance on easy trails like fire roads, even at uptempo paces. Impressively lightweight design, offers a stable ride, excellent traction on easy trails, ideal for midfoot and forefoot strikers, the SkyVault plate provides both protection and bounce, durable long-lasting outsole, and perfect for faster paces.","The Catamount 2 is not designed for wide feet or technical terrain and is not the best for long distances. The upper might be too narrow for many runners, it lacks sufficient cushioning for longer distances, and it is not for technical terrain."
Brooks Catamount 3,https://runrepeat.com/brooks-catamount-3,"The Brooks Catamount 3 blends comfort, stability, and lightness in a versatile trail shoe. It offers excellent ground feel with good cushioning, providing nimble yet stable performance across various terrains. Reduced weight from v2, enhanced flexibility, stable and secure ride, high-quality materials, suitable for all footstrikes, lightweight, fantastic Skyvault plate, and adaptable across various paces.","Breathability and durability could be better. Poor upper ventilation, tight fit for some, and limited grip in wet conditions."
Brooks Divide 3,https://runrepeat.com/brooks-divide-3,"The Brooks Divide 3 is a solid choice for trail runners on a budget who want a versatile shoe equally at home on occasional road runs, those who prefer a firm ride and need a hybrid shoe capable of tackling a variety of surfaces, and Brooks fans who sometimes venture onto easy trails with their road shoes and want something with a bit more grip.","If you favor flexibility in running shoes, the Divide 3 might feel a bit too stiff underfoot even while walking, and if a plush soft ride is what you are after it likely will not hit the mark because the DNA Loft foam feels surprisingly firm. The forefoot may also feel too thin for forefoot strikers planning ultra distances."
Brooks Divide 4,https://runrepeat.com/brooks-divide-4,"We recommend the Divide 4 to runners who need a lightweight neutral trail shoe with a roomy toebox, are new to trail running and want a versatile shoe that is also capable for road running or hiking days, and want a trail shoe that is well cushioned and ready to take on long distance efforts. Good impact protection, smooth ride, feels stable underfoot, works well as a hybrid shoe, suitable for hiking, secure lockdown, comfy fit, accommodates wide feet, grippy outsole, and easy on the wallet.","Runners who frequent more rugged trails will benefit from a more aggressive shoe, and more advanced runners looking for a bouncy and energetic midsole may prefer a more premium option. Midsole feels a little dull, not for technical or muddy trails, and overall issues with durability."
Brooks Divide 5 GTX,https://runrepeat.com/brooks-divide-5-gtx,"The Brooks Divide 5 GTX sticks to its road-meets-trail DNA and is a strong pick for poor-weather daily runs across gravel, dirt paths, and other light-trail surfaces. It is a good pick for anyone who wants a waterproof shoe for daily use that handles many surfaces well including easy trails, runners in cold and wet climates who need a dependable option for gravel runs during bad-weather days, and budget-minded heel strikers looking for a winter-ready shoe that is versatile and affordable.","The Brooks Divide 5 GTX is not the best option if you want a true trail-focused experience because its road-inspired build falls short on tougher terrain, and it is also not the best choice if you really do not need trail lugs and mainly want a road shoe for wet conditions. In the lab the midsole feels a bit too firm and lacks bounce."
Brooks Ghost 14,https://runrepeat.com/brooks-ghost-14,"The Ghost 14 from Brooks fits the bill as a shoe for all runners and works as a comfortable workhorse for easy days, tempo sessions, and even light trails. All about comfort, true to size, lots of padding, smooth ride, really stable even on light trails, great out of the box, built for longevity, and great grip.",The Ghost 14 lacks breathability for hot summer days and is not the best for long distances.
Brooks Ghost 15,https://runrepeat.com/brooks-ghost-15,"The Ghost 15 offers fantastic comfort and is a great choice for daily workouts, especially when cruising at slow or moderate speeds. It is an ideal match for heel strikers that tend to wear out shoes quickly in that area, and it remains a versatile option that is reasonably priced. Supreme comfort, optimized for heel strikers, no heel slippage, great grip in wet conditions, built to endure countless miles, impressive value for $140, great for both running and walking, and available in up to four different widths.","We do not recommend the Ghost 15 for runners who prefer a lighter daily trainer, need a stability shoe, love high-stacked and plush running shoes, or are forefoot strikers because the shoe has an extremely high heel-to-toe drop and insufficient support where they actually hit the ground. Slightly heavier than its predecessor, could use some improvements in breathability, and not a good one for forefoot strikers."
Brooks Ghost 16,https://runrepeat.com/brooks-ghost-16,"Loyal Ghost series enthusiasts who purchase the model every one or two years will find the v16 really familiar yet enhanced. Heel strikers looking for a high-drop workhorse for daily runs and a variety of other activities will appreciate the design and flexibility of this model. Runners who were not satisfied with the Ghost 15 due to lack of energy return will be pleased with the new DNA Loft v3 foam, which provides a significant boost in performance. Dependable, optimal for heel strikers, long-lasting outsole, great stability, improved responsiveness, versatile for multiple activities, and maintains affordable price.","Its substantial heel-to-toe drop may not suit everyone—especially forefoot strikers who might find it limiting during their runs. Midfoot strikers might also find themselves on the edge, as the design doesn't cater particularly well to their needs either. It also lacks a bit of the excitement that some runners seek in a modern daily trainer. Tongue not gusseted, stiff heel counter, low toebox volume, and still needs better energy return."
Brooks Ghost 17,https://runrepeat.com/brooks-ghost-17,"Fans who buy a Ghost every year can confidently proceed again, as it follows the same proven formula with only minor refinements. Those seeking a touch more cushioning will appreciate the added stack height and lower but still high drop from previous models. For runners wanting a single, durable shoe for two or three short runs per week and casual everyday wear, this shoe is ideal. Exceptionally comfortable upper, impressive outsole durability, softest and most cushioned Ghost to date, very stable for a neutral shoe, still a flexible and natural ride, doubles for daily wear, new drop adds versatility, traction is even better than before, and improved aesthetics.","The DNA Loft v3 foam lacks energy return, and runners seeking bounce will likely be disappointed. The tapered toebox may feel restrictive for runners with wide feet. Outdated foam tech with low energy return, non-gusseted tongue despite price hike, still heavy, and tapered toebox."
Brooks Ghost 17 GTX,https://runrepeat.com/brooks-ghost-17-gtx,"Runners who love the Ghost 17 and want a similar shoe for rainy days or winter training in consistently wet weather will do well here. Heel strikers looking for a stable and durable Gore-Tex road running shoe for daily mileage can benefit from it, and it also works well for casual wear, city walks, or commuting. The shoe turns Brooks’ most popular trainer into a waterproof, winter-ready option with stronger wet grip, a highly durable outsole, and a familiar smooth and stable ride.","Runners seeking a lively and fun ride may feel underwhelmed because the DNA Loft v3 midsole delivers a somewhat dull-feeling ride with modest energy return. It also carries an added price premium over the regular version that looks a bit excessive, and energy return remains limited."
Brooks Ghost Max,https://runrepeat.com/brooks-ghost-max,"Enthusiasts of the regular Ghost looking for a softer, more cushioned alternative for their long runs and easy days will appreciate it. Runners who loved the original Nike Invincible feel and are searching for a max-stack, plush training shoe should like it, and fans of maximalist shoes eager to explore options beyond the usual Hoka picks may also fit well. Exceptionally cushioned, impressively lightweight for its size, extremely comfortable, remarkably stable, durable outsole with long-lasting performance, a genuine maximalist version of the Ghost, reasonably priced at $150, and offered in three width options.","Its plush midsole does not provide the best energy return on the market, and it is not the top choice for those seeking a high-quality upper because the tongue is not attached to the sides and the upper falls short in durability. Tongue is not fixed to the sides, lacks energy return, and not very flexible."
Brooks Ghost Max 2,https://runrepeat.com/brooks-ghost-max-2,"Fans of the original Ghost Max, or any loyal Ghost runner looking for added cushioning, are a strong fit. Runners seeking a high-stack, durable daily trainer that offers impressive comfort at a reasonable price should like it, and beginners interested in trying a maximalist shoe without the premium price tag can also benefit. Improved energy return, fantastic value, great durability, breathable upper, outsole grips well even on wet surfaces, doubles as a walking shoe, excels at easy paces, superior stability, and ready for long runs.","If a nimble ride is a priority, the added weight versus the predecessor is a clear drawback. Would benefit from softer foam, clunky for heel strikers, a bit heavy, and non-gusseted tongue."
Brooks Ghost Max 3,https://runrepeat.com/brooks-ghost-max-3,"Midfoot and forefoot strikers who enjoy the feel of the regular Ghost but want a more cushioned option for longer runs are a good fit. Runners looking for a dependable shoe with strong traction and long-lasting durability for daily miles or casual use should also like it, and beginners wanting to try a max-stack trainer that stays well below the $200 price point can benefit too. Exceptionally comfortable and secure upper, solid durability overall, impressively stable, finally modern aesthetics, perfect for midfoot and forefoot strikers, versatile enough to wear as a sneaker, luxuriously padded tongue and heel collar, reasonable price for a max-stack shoe, and best for slow runs.","Runners who prioritize strong heel cushioning, especially many heel strikers, may find its shock absorption weaker than most other max-stack shoes. Heavier than most rivals, foam lacks energy and responsiveness, less suitable for heel strikers, and not enough shock absorption in the heel."
Brooks Glycerin 19,https://runrepeat.com/brooks-glycerin-19,"This is a plush daily trainer built for daily runs with a roomy toebox and a soft stable ride. Plushy, tongue stays put, perfect midfoot lock, soft and stable ride, durable, great grip even on dirt roads, roomy toebox, smooth ride, and perfect for daily runs.",It lacks pep underfoot and can feel too warm for summer days.
Brooks Glycerin 20,https://runrepeat.com/brooks-glycerin-20,"A comfy and great-value option for both beginners and running veterans. A reliable daily trainer for long miles and mellow days on the road. Plush cushion, awesome step-in feel, breathable for hot days, tank-like build, weighs less than looks, awesome value for money, comfortable fit, and grippy on wet road and gravel.","Laces don't stay tied, heel drop higher than advertised, and energy return is low."
Brooks Glycerin 21,https://runrepeat.com/brooks-glycerin-21,"Heel strikers in search of a max-cushioned shoe that can handle every distance in marathon training are a strong fit. Those who want a daily trainer with an outsole that endures mileage like few others on the market can also benefit, and fans of the popular Ghost looking for a slightly more cushioned option while retaining the classic Brooks look and feel should like it. The shoe stands out as the best Glycerin yet with enhanced cushioning, a robust outsole, and unmatched comfort from the first mile.","It primarily caters to rearfoot strikers and may polarize some runners, and it can feel too warm for hot summer runs. The knit upper offers inadequate ventilation for hot or humid summers."
Brooks Glycerin 22,https://runrepeat.com/brooks-glycerin-22,"Loyal Glycerin fans who want the familiar formula with updated tech and subtle refinements are a match. Runners seeking a comfortable, durable, and highly ventilated daily trainer for effortless miles can benefit, and heel strikers who need a high-drop shoe that excels at easy paces across any distance are especially well served. DNA Tuned improves shock absorption, stable ride, highly breathable upper, increased stack height, all-around comfort, first-class durability, perfect for everyday miles, awesome for heel strikers, and great as an everyday shoe.","The shoe is heavier, pricier, and stiffer than before, which may not appeal to everyone. It also has a low toebox height and is not the most energetic ride. Needs to lose some weight, low toebox height, price increase, and not the most energetic ride."
Brooks Glycerin GTS 20,https://runrepeat.com/brooks-glycerin-gts-20,"Runners looking for a versatile shoe with massive support in both the heel and midfoot areas are a good fit. Brooks enthusiasts aiming to add a daily stability trainer to their collection can benefit, and heel strikers who want a well-cushioned stability running shoe and don't mind the $160 price tag should like it. Excellent for heel strikers, provides protective cushioning, offers comfort on easy running days, ensures smooth transitions, features a secure heel counter, comes with a soft stretchy upper, good breathability, and effective GuideRails system.","The midsole may feel overly firm for some runners, it is pricier than many alternatives, and it is on the heavier side."
Brooks Glycerin GTS 21,https://runrepeat.com/brooks-glycerin-gts-21,"Runners who desire a daily trainer that provides fantastic stability without the clunkiness or extra weight typically associated with such features are a strong fit. Neutral runners in need of enhanced support, particularly useful during the final miles of long runs, can benefit, and mild pronators or runners with recurrent shin splints issues looking for ample cushioning and extraordinary durability should also like it. The StealthFit/GTS 21 formula emphasizes support, durability, and comfort for daily mileage.","This shoe is a support-focused option and may be less appealing to runners who do not want added stability elements. Based on the review, tradeoffs center on support-first tuning rather than maximum liveliness."
Brooks Glycerin GTS 22,https://runrepeat.com/brooks-glycerin-gts-22,"Those seeking a daily trainer offering superior stability without the bulky feel often found in this category are a match. Heel strikers who typically wear down outsoles quickly and want a durable, long-lasting option that justifies the price tag can benefit, and anyone dealing with moderate pronation who needs a highly cushioned platform ready for long runs should fit well. The Glycerin GTS 22 delivers a support-loaded ride with top comfort for long runs and world-class outsole durability.","The DNA Tuned midsole feels a bit firmer than expected, and the ride is oriented more toward stable underfoot comfort than excitement."
Brooks Glycerin Max,https://runrepeat.com/brooks-glycerin-max,"Brooks fans who have turned to other brands for a true max-cushion shoe finally have one here. Runners seeking a plush, comfort-driven daily trainer that emphasizes support over speed will fit well, marathoners who value max protection on easy and recovery runs should like it, and anyone who loves Brooks' step-in feel and wants a running shoe that doubles as a sneaker can also benefit. Massive impact dampening, luxurious yet breathable upper, new DNA Tuned midsole, eye-catching look, surprisingly stable, can be used as a walking shoe, and premium materials.","It is too heavy for some runners, the midsole lacks bounce, rubber coverage is poor, and the price tag is high."
Brooks Glycerin Stealthfit 20,https://runrepeat.com/brooks-glycerin-stealthfit-20,"Runners looking for a comfy and protective road shoe are a good fit. Those who need a reliable shoe that performs consistently regardless of season can benefit, and runners in the market for a versatile daily trainer that can do a bit of everything or have slightly pronating strides but prefer neutral shoes that feel stable underfoot should also like it. Responsive midsole, good impact dampening, suitable for recovery days and long distances, stable and smooth ride, extremely breathable, seamless upper, snug sock-like fit, super comfy and suitable for all day wear, durable outsole and upper construction, and great traction even on wet surfaces.","The midsole can feel somewhat firm, the shoe needs breaking in, and it is pricey for a daily trainer."
Brooks Glycerin StealthFit 21,https://runrepeat.com/brooks-glycerin-stealthfit-21,"Fans of the classic Glycerin who desire a more secure, locked-in upper and a lighter overall build are a strong fit. Marathoners looking for a durable, lightweight daily trainer that can handle extensive mileage with ease should like it, and those seeking a versatile workhorse with a knit sock-like upper that's perfect for winter running can benefit. Durable outsole, sock-like tongue, significant weight reduction, comfortable fit, great for long runs, improved heel counter, and supercritical foam.","It needs more breathability and lacks energy return. It also gives up some cushioning and airflow in exchange for its snugger, lighter StealthFit setup."
Brooks Hyperion,https://runrepeat.com/brooks-hyperion,"Runners who want a lightweight shoe with plenty of pep in its step for uptempo days are a match. Those who prefer flexible shoes capable of speed without relying on a stiff plate can benefit, and fans of the previous Hyperion Tempo should feel at home. Great for uptempo runs, fast and responsive ride, well cushioned for impact, flexible and forgiving underfoot, lightweight, stable cornering, grippy outsole, accommodating toebox, secure lockdown, and great value.","It has a much higher heel drop than expected, only average breathability, upper durability issues, and it can feel different depending on the weather."
Brooks Hyperion 2,https://runrepeat.com/brooks-hyperion-2,"Runners craving a classic, low-to-the-ground ride that recalls racing flats from years past are a strong fit. Brooks fans seeking an interval trainer to complement the Hyperion Max 2 can benefit, and athletes seeking a streamlined running shoe that boosts foot strength and offers an exhilarating ride at faster paces should like it. Insanely lightweight, awesome racing-flat vibes, perfect for tempo workouts, promotes foot strength, grippy outsole in wet and dry surfaces, reasonably priced, amazing airflow, and can double for track workouts.","It is limited in versatility and is not a stable ride. The midsole also still needs more energy return for runners wanting a more modern, bouncier feel."
Brooks Hyperion 3,https://runrepeat.com/brooks-hyperion-3,"Runners who want a state-of-the-art upper at a very reasonable price are a strong fit. Those who felt the Hyperion 1 or 2 did not offer enough cushioning underfoot can benefit, and heel strikers who need a comfortable, breathable, and durable option for easy days and light tempo work should also like it. Exceptional upper, good value without a price increase, secure and plush fit, higher stack adds versatility, softer midsole than v2, reliable durability, excellent for heel strikers, superb stretchy tongue, and good option for beginners.","It is much heavier than its predecessor, needs more energy return, and has lost some of the natural-feeling ride."
Brooks Hyperion Elite 4,https://runrepeat.com/brooks-hyperion-elite-4,"This is Brooks' super shoe for runners who want a competitive racer with upgraded upper, outsole, and carbon-plate performance. The shoe is aimed at runners seeking a race-day option from Brooks with notable improvements over earlier efforts.","It still trails the top-tier super shoes, the supercritical EVA midsole falls short on energy return, and the weight is hefty for the category."
