shoe_name,url,positive_text,negative_text
Adidas 4DFWD,https://runrepeat.com/adidas-4dfwd,"Who should buy: A successor to Adidas' 3D midsole saga, the 4DFWD wears its innovative 3D-printed cushioning on its dreamy knit sleeve. Add this shoe to your shopping cart if you want a pair that catches the eyes of many, whether in a casual or running setting, and if futuristic sneakers are your thing. Pros: Bouncier than most 4D shoes, comfortable in-shoe feel, wider-than-average sole, very flexible, durable outsole, innovative cushioning tech, attention grabber, sustainable.","Who should not buy: If you prefer a lighter and more affordable pair of Adidas running shoes, consider the Adizero Boston 11. If you are concerned about the upper stretching out too much over time, look at the 4DFWD v2 instead because it comes with a more structured upper. Cons: Upper stretches a lot over time, lacks breathability, rather heavy."
Adidas 4DFWD 2,https://runrepeat.com/adidas-4dfwd-2,"Who should buy: This distinctive offering from Adidas is a solid option to consider if you are a sneakerhead and want a running shoe that looks, and indeed is, very cool, for your casual and daily runs, or to use all day. Pros: Unique midsole construction, supportive fit, comfortable in-shoe feel, good grip on roads, extremely durable, plenty flexible, stunning design, environmental-friendly.","Who should not buy: If you want an affordable option, the Adidas Adistar is a better choice. If you need something lighter instead, the Adidas Adizero Boston 11 is about 80 g lighter in a men's US 9. Cons: Not for the budget-minded, very heavy, not for wide feet, some breaking-in required."
Adidas 4DFWD 3,https://runrepeat.com/adidas-4dfwd-3,"Who should buy: The Adidas 4DFWD 3 is an excellent choice for neutral runners in the market for a well-cushioned and flexible daily trainer for low-intensity runs, runners in cooler climates looking for a shoe that will keep their feet warm and perform consistently all year round, and style-minded individuals looking for an eye-catching exercise shoe that's also good for strutting about town. Pros: Extremely comfortable, excellent traction, great 4D midsole cushion, durable upper and outsole, flexible and forgiving on the foot, secure lockdown, works great as a walking shoe, warm and consistent in the cold, eye-catching design, lots of colorway options.","Who should not buy: With its lackluster performance in the breathability test, the 4DFWD 3 is not very well suited for warm weather runs; the Allbirds Tree Dasher 2.0 is better ventilated. At 12.3 oz (348 g), the 4DFWD 3 is not as light as its appearance suggests; the ASICS Dynablast 3 is a much lighter and more versatile option for runners who are more serious about running. The toebox may prove a little too snug for runners with broad feet; the Adidas Switch FWD is a roomier alternative. Overpronators will not find the stability they need with the 4DFWD and should look into options like the Brooks Adrenaline GTS 23 or Nike Structure 25 instead. Cons: Quite heavy, not good for high speeds or long distances, below average breathability, relatively narrow toebox."
Adidas Adistar,https://runrepeat.com/adidas-adistar,"Who should buy: If you're any of the following, don't write off the Adistar from Adidas: neutral runners looking for a shoe that's stable and guides the foot, road runners who want a daily trainer with plenty of padding, runners who want a protective shoe for recovery days and long runs, and heel strikers who want to change their running stride. Pros: Stable landings, maxed-out cushion, relaxed and accommodating fit, roomy toe box, tongue stays in place, durable, summer-ready breathability, recycled upper, grippy on ice, great for long runs.","Who should not buy: Adidas fans who want something lighter and cushier can go for the Adidas Ultraboost Light. Runners who want a soft yet responsive ride can look at the Nike Invincible Run 3 or Hoka Clifton 9, and heel strikers who want a more forgiving rearfoot can opt for the Saucony Triumph 20 instead. Cons: Could be more responsive, firm for heel strikers, heavier than most trainers, becomes a brick in winter."
Adidas Adistar 2.0,https://runrepeat.com/adidas-adistar-20,"Who should buy: This workhorse from Adidas is for runners in search of a max-cushioned shoe for long and easy miles, a neutral shoe with a touch of support as a semi-stability shoe, a design that's stylish and comfortable enough for casual wear, and a daily trainer that doesn't break the bank because Adistar 2.0 costs $15 less than similar shoes. Pros: Cushioned for long miles, supportive for a neutral shoe, wide platform, secure foothold, well-padded interiors, highly breathable, great for casual wear, value for money, true to size.","Who should not buy: The Adidas Adistar 2.0 is very heavy at 11.6 oz / 328 g even for its max-cushioned kind, and there are shoes with the same heel stack that weigh nearly 100 g less, such as the Adidas Adizero SL and PUMA Velocity Nitro 2. If you are a heel striker, you may also prefer a plusher foam under the heel, like the Adidas Ultraboost Light. Cons: Heavier than average, firm heel landings."
Adidas Adistar 3,https://runrepeat.com/adidas-adistar-3,"Who should buy: The Adidas Adistar 3 is for fans of the previous Adistar models who demanded a lighter, more cushioned version because it delivers on both fronts, weekend warriors hitting the pavement 1 or 2 times a week who prioritize comfort in a running shoe, and budget-conscious buyers looking for a plush daily trainer that doubles as a comfortable walking shoe with a breathable upper. Pros: Amazing weight reduction, better running experience than v2, reasonably priced, suitable for walking, cushions long runs, breathable upper, exceptional all-around comfort.","Who should not buy: While the Adistar 3 offers several improvements over its predecessor, its stability has significantly decreased, making it a less appealing option for runners needing good support; more reliable mild-stability trainers include the ASICS GT 2000 12, Hoka Arahi 7, and ASICS Gel Kayano 31. Cons: No more Continental, lacks energy return, upper needs better durability."
Adidas Adizero Adios 7,https://runrepeat.com/adidas-adizero-adios-7,"Who should buy: The Adidas Adizero Adios 7 is a solid choice for anyone that needs a not-so-expensive but fast shoe, fans of old-school racing flats, and 5K/10K aficionados that want to do shorter-than-mile repeats on the track. Pros: Snappy ride, great for fast track workouts, well ventilated, amazing ground feel, lighter than ever, the outsole lasts forever, grippy Continental rubber, modestly priced.","Who should not buy: This shoe offers an energetic and potentially enjoyable ride, but it can also be physically demanding on the muscles. If you typically train in shoes with modern, cushioned foams, this racing flat may not be the ideal choice for fast workouts or races, especially given the availability of the highly acclaimed and Lightstrike-Pro-based Adidas Adizero Adios Pro 3. Cons: Not for cold weather, heel slippage, needs more Lightstrike Pro, ride is too firm."
Adidas Adizero Adios 8,https://runrepeat.com/adidas-adizero-adios-8,"Who should buy: The Adios 8 is a great choice for runners who want to go fast but do not enjoy the rigidity of carbon-plated shoes, prefer more ground-feel underfoot with a lower stack and cushioning that feels balanced, want a race-ready shoe that will not break the bank, go out for runs in the summertime or in hot climates, and have a wider foot. Pros: Extremely breathable, snappy and speedy ride, suitable for tempo runs and long distances, fits wider feet, secure lockdown, grippy and durable outsole, budget friendly for a race-ready shoe at $130, ideal for forefoot strikers.","Who should not buy: The more traditional sensation of the Adios 8’s midsole cushion means it does not provide the assistance or cruising capabilities of modern midsoles; for a speedy shoe with more technology underfoot, the Saucony Endorphin Speed 3 is a better option. Heel-striking or long-distance runners will also be better served with more foam underfoot and a slightly higher heel drop, such as the Saucony Endorphin Speed 3 or ASICS Metaspeed Sky+. Runners with a pronating stride should consider the Brooks Launch GTS 10 instead. Cons: Could be lighter, not for harsh winter days, noisy."
Adidas Adizero Adios 9,https://runrepeat.com/adidas-adizero-adios-9,"Who should buy: The Adios 9 is the perfect shoe for runners who miss old-school racing flats with low stacks and zero plates, those wanting a tempo-ready shoe that feels fast and natural, lightweight midfoot strikers seeking a shoe for fast-paced efforts with massive energy return, and fans of the Adizero Adios 8 because version 9 is a huge upgrade. Pros: Full Lightstrike Pro superfoam, incredibly lightweight and fun, great for tempo sessions, works as a plateless 5K/10K racer, durable and grippy outsole, excellent value, ideal for track workouts.","Who should not buy: The Adios 9 is not the best choice for runners needing generous cushioning because its low-stack build feels ultra-connected to the ground and may fall short for those wanting the ultimate leg-saving experience; the Adizero EVO SL is a better fit for that. It is also not recommended for runners who expect a super shoe-like experience because it lacks the rigid, carbon-plated snap that defines that category; for a more race-ready feel in a low-stack format, the Nike Streakfly 2 or New Balance FuelCell SuperComp Pacer v2 are better alternatives. Cons: Not stable at all, tapered toebox, not ideal for heel strikers, upper lacks airflow."
Adidas Adizero Adios Pro 2.0,https://runrepeat.com/adidas-adizero-adios-pro-20,"Who should buy: Buy this shoe if you want a top-end race day shoe to squeeze your best effort out of. It is fast, fairly comfortable, decently priced, and proven to win world records. If you are a three-stripe fan and want a super shoe alternative to the usual choice, this is the one. Pros: Breathable, responsive, carbon rods, soft midsole, laces stay tight, price.","Who should not buy: Do not buy this shoe if you have super wide feet, if you do not need the top-of-the-line but still want a fast modern race shoe and would rather check out the Adidas Adizero Boston 12, or if you just want a fun, bouncy, light shoe but do not need it to be carbon plated and would rather try the New Balance FuelCell Rebel v2. Cons: Runs narrow, unstable at slow speeds."
Adidas Adizero Adios Pro 3,https://runrepeat.com/adidas-adizero-adios-pro-3,"Who should buy: The Adidas Adizero Adios Pro 3 is an excellent pick for any race from a short 5K to the marathon. It is designed for midfoot or forefoot strikers looking for a reliable racing shoe for upcoming races spanning from the 5K to the marathon, runners on the hunt for a top-tier racing shoe that offers stability without the lateral wobble often found in racing models, and fans of the Adios Pro series with wide feet who need enhanced stability and felt the previous editions too narrow. It also excels in interval training thanks to its long-lasting outsole and durable midsole. Pros: Supreme stability in a supershoe, world-class energy return and cushioning, feather-light and agile, a dream come true for marathoners, wonderful breathability, top-notch grip even in wet conditions, outstanding outsole durability, accommodates wide feet.","Who should not buy: Diehard fans of the Adizero Adios Pro 2.0 may want to stick with their current model rather than upgrade because version 3 is significantly wider and caters more to midfoot strikers, while version 2 suits heel strikers better due to its high drop. Those with a preference for extremely plush racing shoes might also find the Adios Pro 3 disappointing because it feels somewhat firmer than competitors like the Nike Alphafly 2 or Saucony Endorphin Pro 3. Cons: Risk of heel slippage, lacing can be tricky, not suited for heel strikers."
Adidas Adizero Adios Pro 4,https://runrepeat.com/adidas-adizero-adios-pro-4,"Who should buy: The highly anticipated Adios Pro 4 is an ideal choice for runners who found the Adios Pro 3 too firm, disliked its upper, or struggled with its heel lockdown, anyone in need of a responsive-and-grippy super shoe that excels across every race distance from 5K to marathons, midfoot and forefoot strikers looking for a plush super shoe, and runners who prefer a more flexible racing shoe over ultra-stiff options. Pros: Softer and bouncier Lightstrike Pro foam, maintains the same price, no more heel slippage, versatile from 5K to marathon distances, durable outsole with outstanding grip, fantastic for midfoot and forefoot strikers, improved for faster runners, comfortable gusseted tongue, lighter than Adios Pro 3.","Who should not buy: The Adios Pro 4 introduces some drawbacks worth considering. The fit now features a tapered toebox design that sacrifices the wide-foot comfort of the Adios Pro 3, so runners concerned about that may prefer the Nike Alphafly 3. Heel strikers may find the Adios Pro 4 really unstable due to its exceptionally narrow heel and may be better off with the Saucony Endorphin Pro 4. For runners who find the price or stiffness of traditional super shoes off-putting, the Adidas Adizero EVO SL is a smarter choice. Cons: Unstable for every heel striker, narrow tapered toebox, upper lacks breathability, midsole loses bounce quicker than AP3."
Adidas Adizero Adios Pro Evo 2,https://runrepeat.com/adidas-adizero-adios-pro-evo-2,"Who should buy: Based on our testing of the Adidas Adizero Adios Pro Evo 2, we think it works well for those who do not worry about budget and simply want Adidas’ latest hypershoe, marathoners who want an extremely lightweight shoe and prioritize grams above all else, and runners who benefit from a strong forefoot rocker and feel more efficient with this geometry. Pros: Insanely lightweight; fast and responsive; aggressive, efficient rocker; breathable, paper-thin upper; feels incredible at faster paces; specifically built for the marathon distance; uncompressed Lightstrike Pro Evo foam; ideal for midfoot and forefoot strikers.","Who should not buy: In our view the insane price of the Adios Pro Evo 2 makes no sense for 99.9% of runners, even if the tech behind the shoe looks impressive. We believe there are better choices which deliver similar or even better performance at a lower cost. From our perspective the limited durability also turns this ultra-premium, race-only model into a tough sell, and we think it’s not the best choice when other shoes strike a smarter balance of cost, longevity and performance. Cons: Crazy high price; extremely narrow toebox; low durability; we expected a bit more bounce!"
Adidas Adizero Boston 11,https://runrepeat.com/adidas-adizero-boston-11,"Who should buy: Consider choosing the Adidas Adizero Boston 11 if you struggle with stability and need a shoe that can handle a wide range of paces, are looking for a durable shoe that can handle races and don't mind it being heavier than racing shoes, and seek a cushioned-yet-firm ride for long-distance training sessions. Pros: Very stable for being a high-stack shoe; excellent grip; breathable upper; versatile for different workouts; protective underfoot; extremely durable outsole; made with recycled materials; attractive design.","Who should not buy: If you prefer plush or even moderately soft foams, we suggest staying away from the Boston 11. The same advice goes for those in search of flexible running shoes, as this one leans towards firmness and rigidity with its Energyrods. For moderate-to-slow paces, consider a fast-and-light daily trainer that comfortably handles a wide range of speeds; if a flexible tempo trainer is what you're after, this may not be your match. Cons: Definitely stiff and firm; long breaking-in period."
Adidas Adizero Boston 12,https://runrepeat.com/adidas-adizero-boston-12,"Who should buy: The upgraded Adidas Adizero Boston 12 is a truly impressive shoe, and here's who we think will love it the most: midfoot-to-forefoot strikers looking for a training partner with outstanding grip; those who are fans of the Boston series but felt let down by the heavier weight of versions 10 and 11; and any runner in need of a versatile shoe that can handle all sorts of training runs, regardless of how fast or long they might be. Pros: Delivers a fun ride; lighter than versions 10 and 11; handles both slow and fast paces with ease; wide toebox; durable and grippy Continental outsole; even more Lightstrike Pro superfoam; improved stability due to a broader base; fantastic for midfoot-to-forefoot strikers.","Who should not buy: If you're in the market for a soft, flexible running experience, we believe the Boston 12 might not be your shoe. While it's softer than its predecessor, it still delivers a somewhat firm and stiff feel underfoot. We also think there are better options if you plan to use the shoe for pure racing or track workouts. It's a bit too heavy for those purposes, and if budget isn't a concern there may be superior picks; if you're looking for a budget-friendly shoe for fast runs or short races, there are other options to consider. Cons: Upper durability falls short; tongue and heel could benefit from extra padding; heel strikers might prefer v11."
Adidas Adizero Boston 13,https://runrepeat.com/adidas-adizero-boston-13,"Who should buy: After testing the Adizero Boston 13 to its limits, we can recommend it for all runners who enjoyed the Boston 12, as it’s a similar ride with a lighter build, better upper, and improved comfort; midfoot and forefoot strikers needing a stiff shoe that works wonders for tempo runs and the occasional race; and fans of Adidas super shoes looking for a solid training partner that won’t empty their wallets. Pros: Keeps losing weight; midfoot-friendly geometry; more Lightstrike Pro; breathable upper; redesigned heel counter improves lockdown; outsole grips well and lasts forever; stellar value for a supertrainer; ideal for tempo workouts.","Who should not buy: The carbon-based Energy Rods 2.0 make this shoe stiff, and definitely not for runners who dislike that rigid, plate-like feel. We also believe heel strikers looking for extra rearfoot stability won’t enjoy the Boston 13. Lastly, the tapered toebox may cause discomfort on long runs, and some runners may want more room for their toes. Cons: Narrow heel limits stability; pointy toebox restricts toe splay; still too much Lightstrike 2.0?"
Adidas Adizero EVO SL,https://runrepeat.com/adidas-adizero-evo-sl,"Who should buy: Despite its limited early release, we managed to buy a pair of the Adizero EVO SL, and after dissecting it and testing every detail, we recommend it for beginners wanting a do-it-all shoe for training and racing that offers reliable performance at an unbeatable price, anyone seeking a speedy, durable and fun training partner, runners who dislike carbon plates but crave world-class performance and grip, and those searching for a versatile shoe with premium foam without breaking the bank. Pros: 100% Lightstrike Pro superfoam; exceptional value-to-performance ratio; low weight; ultra-breathable upper; unmatched versatility; agile and fun ride; handles short and long runs with ease; striking Evo 1-inspired aesthetics.","Who should not buy: The EVO SL impressed us in many ways, but we think it’s not the best choice for runners with stability concerns. Its narrow midsole and lack of support make it unsuitable for those needing even mild support. Additionally, we know this shoe won’t satisfy runners seeking the sensation of a plate, since the EVO SL is designed for a more natural ride. Finally, the limited early release by Adidas might make it impossible to spend your money on this shoe, and if it’s unavailable but you’re seeking a similar experience, you may need alternatives. Cons: Poor-quality laces; short, non-gusseted tongue; toebox durability."
Adidas Adizero EVO SL ATR,https://runrepeat.com/adidas-adizero-evo-sl-atr,"Who should buy: In our opinion, the Adizero EVO SL ATR suits perfectly fans of the Adizero EVO SL who struggled with its poor grip and protection in wet conditions, runners who liked the original model but wanted more confidence beyond perfectly paved roads, anyone looking for a cold-ready daily trainer with very high energy return that still comes at a reasonable price, and runners in cold climates who want one shoe for everyday runs and daily use without giving up speed or performance. Pros: Impressive energy return and shock absorption; premium-quality laces, finally; top traction thanks to updated Conti rubber; ideal for winter training and cold conditions; water-repellent upper; still delivers insane value; works well across a wide mix of surfaces; versatile for many paces; feels a bit more stable than the regular edition.","Who should not buy: We’ve observed that the EVO SL ATR’s heat-trapping upper works great in winter, but we do not recommend it for warm weather. In our experience, the low airflow becomes uncomfortable fast. We’re under the impression that the ATR label can be misleading for some runners, and we think it’s not the best choice for serious trail running, as the shallow-lug outsole only suits very mild paths. Cons: Noticeably heavier than the regular EVO SL; virtually no ventilation; significantly reduced flexibility; limited heel stability."
Adidas Adizero Prime X 2 Strung,https://runrepeat.com/adidas-adizero-prime-x-2-strung,"Who should buy: We've concluded that the Adidas Adizero Prime X 2 Strung is an outstanding choice for those who enjoyed the fun and bouncy ride of the original Prime X but felt it too unstable, as this update delivers enhanced support; marathoners unconcerned with World Athletics regulations who prioritize ultimate cushioning and technology regardless of cost and rules; and anyone with at least $300 in the bank to invest in top-tier engineering, since we’re convinced the technology behind the upper, midsole, and outsole make this shoe a real masterpiece. Pros: Amazing Strung upper; impressive durability; rule-breaker cushioning; integrated dual carbon plates; top energy return; exceptional Continental outsole; wonderful for long distance training; stability exceeds expectations; superior build quality; screams innovation.","Who should not buy: The Prime X 2 Strung really showcases what Adidas is capable of, but it's a double-edged sword because of its high weight. It's clear for us that this shoe isn't the best choice for short races, and we're hesitant to recommend it even for half or full marathons. For a thrilling and unique running experience, some may prefer other models that offer a similar ride with much less bulk. Moreover, the steep price tag of the Prime X 2 Strung may deter many runners, and there are better choices out there for those seeking a max-cushioned running shoe. Cons: Simply too heavy; exorbitantly priced at $300; less exhilarating than v1."
Adidas Adizero Prime X3 STRUNG,https://runrepeat.com/adidas-adizero-prime-x3-strung,"Who should buy: We recommend the Adidas Adizero Prime X3 STRUNG for runners with plenty of room in the budget who want a shoe loaded with next-level foam and cutting-edge tech, Adidas fans looking for the brand’s top-tier innovation all wrapped into one model, those chasing a maximalist shoe with sky-high shock absorption and energetic bounce, and loyalists of the Prime X who felt the second version lost its spark, because this one brings back a bit of v1's magic but with a calmer, more stable ride. Pros: Excellent shock absorption; fantastic bounce from new Lightstrike Pro foam; fits better than v2; innovative tech and design from heel to toe; STRUNG upper is just awesome; works well on any season; skyscraper-like stack height; a total blast if it suits you; breathable upper.","Who should not buy: We think the Prime X3 STRUNG falls short as a race-day option, and most carbon-plated super shoes offer similar shock absorption in a lighter, more race-ready build. Additionally, we believe that even as a high-tech super trainer, the price tag will be too high for most. With other options delivering similar performance at a much lower cost, the Prime X3 feels like a niche pick that only makes sense if price isn't a concern at all. Cons: Crazy expensive; heavier than all supershoes; heel strikers may feel unstable; too stiff for easy days."
Adidas Adizero SL,https://runrepeat.com/adidas-adizero-sl,"Who should buy: In our view, the Adidas Adizero SL is an excellent choice for beginners embarking on their running journey and seeking an all-rounder, individuals who find the Pegasus too narrow and desire a wider alternative, and runners who appreciate firmer midsoles and need a durable running shoe. Pros: Spacious upper; durable outsole; highly breathable mesh; surprisingly light; stable for being a neutral daily trainer; great value; suitable for track workouts.","Who should not buy: If a soft, cloud-like midsole is your thing, steer clear of the Adizero SL because it's on the firmer side. For heel strikers who require added stability, this shoe might not work out either, because it's just too narrow. Cons: Lightstrike feels like a brick; low energy return in the heel; heel is extremely narrow."
