shoe_name,url,positive_text,negative_text
ASICS Gel Venture 9,https://runrepeat.com/asics-gel-venture-9,"Who should buy: This ASICS trail shoe is an ideal choice for runners seeking a wallet-friendly cushioned trail running shoe, a versatile all-rounder that handles trail running hiking and even road running when necessary, and a shoe with a classic design that doesn't draw undue attention. Pros: Fantastic value, summer-ready mesh upper, enough stack height, stable ride, good for heel strikers, ready for hiking, GEL technology for amazing impact protection.","Who should not buy: If you're searching for a bouncy ride with a higher-end feel or waterproof features, steer clear of the ASICS Gel Venture 9, and if you're primarily looking for maximum durability for the money there may be better options. Cons: Durability could be better, lacks energy return, heavy."
ASICS GlideRide 3,https://runrepeat.com/asics-glideride-3,"Who should buy: Treat yourself to the third version of the ASICS GlideRide if you want a pair of long-distance running shoes that are comfy and smooth-rolling, or a neutral shoe that has pronounced stability and is lightweight. Pros: Seamless heel-to-toe transitions, very stable, lighter than version 2, dampens impact, welcomes wide feet, secure heel hold, long-lasting, no lace bites, tongue stays in place, awesome value.","Who should not buy: The GlideRide 3 is not the best choice if you are looking for a shoe that can do more and easily pick up the pace beyond easy-run duties. Cons: Warm for the summer months, lacks pop for faster runs."
ASICS Glideride Max,https://runrepeat.com/asics-glideride-max,"Who should buy: runners wanting a highly cushioned long-run shoe with a smooth rocker and easy set-and-forget cruising feel. Pros: deep cushioning, smooth well-balanced rocker, and strong comfort for easy and long miles.","Who should not buy: runners looking for a versatile or speed-friendly trainer, or shoppers sensitive to price. Cons: expensive, stiff build, towering stack, and limited versatility for fartleks or faster work."
ASICS Glideride Max 2,https://runrepeat.com/asics-glideride-max-2,"Who should buy: runners who like guided, rockered daily trainers and want a secure upper, strong outsole grip, and protective cushioning for steady mileage. Pros: fantastic upper, extra-secure grip, and a smooth forward-rolling ride.","Who should not buy: runners who dislike a stiff guided feel or expect high value and lively rebound. Cons: high price, only moderate energy return, and a strong rocker that can feel stiff and restrictive."
ASICS GT 1000 10,https://runrepeat.com/asics-gt-1000-10,"Pros: Fits true to size, great stability shoe, good value, good amount of cushioning, no time to wear in, amazing grip, durable.",Cons: details not fully captured on the page excerpt for this pass.
ASICS GT 1000 11,https://runrepeat.com/asics-gt-1000-11,"Who should buy: Get the GT 1000 11 if you want a supportive road running shoe for both mild to moderate overpronators and neutral runners, or a budget shoe that's light and comfortable for long hours. Pros: Stable ride, unobtrusive for neutral runners, lightweight, comfortable all-day, very affordable price, more flexible than before, perfect fit for narrow feet.","Who should not buy: The GT 1000 11 is not the best option if you suffer from excessive overpronation or if you want room for wide feet. Cons: Not for wide feet, simple looks."
ASICS GT 1000 12,https://runrepeat.com/asics-gt-1000-12,"Who should buy: The ASICS GT 1000 12 is a top pick for folks looking for a budget-friendly and plush stability shoe, runners wanting a do-it-all shoe that offers more stability than the average neutral trainer, and anyone on the hunt for a stability running shoe that offers out-of-this-world breathability and comfort. Pros: Incredible value for the price, cushioned and soft midsole, offers great stability, GEL technology in the heel, perfectly comfortable for cross-training or walking, built to endure long-distance runs, offers exceptional breathability, durable outsole with a long lifespan.","Who should not buy: The GT 1000 12 may not meet expectations if you want a shoe with more cushioning or if you lean toward a natural firmer feel and better energy return. Cons: Flytefoam could offer better energy return, upper lacks durability."
ASICS GT 1000 13,https://runrepeat.com/asics-gt-1000-13,"Who should buy: The ASICS GT 1000 13 is an exceptional choice for runners with just over $100 to spend who want a stable durable and comfortable daily trainer, for fans of the GT 1000 series who want one of the best versions yet with PureGEL technology, and for heel strikers looking for moderate support in a shoe versatile enough for grocery shopping and dog walking. Pros: Enhanced overall comfort, PureGEL technology for softer landings, durable outsole, ready for long runs, doubles for walking or gym sessions, enhanced for heel strikers, reasonable weight.","Who should not buy: The GT 1000 13 falls short for runners seeking a bouncy ride, and it may also not offer the best geometry for runners with an extreme heel-striking technique due to its medium drop. Cons: Price increase, lackluster bounce, breathability downgrade, grip has room for improvement."
ASICS GT 1000 14,https://runrepeat.com/asics-gt-1000-14,"Who should buy: The ASICS GT 1000 14 is a solid pick for runners who want a no-fuss stability daily trainer with top durability and an affordable price, who upgrade their GT 1000 every one or two years and want thoughtful improvements like better shock absorption, or who like the GT 2000 but prefer a more budget-friendly option. Pros: Supercharged stability, ideal for heel strikers, still offers amazing value, fuss-free durable design, improved outsole traction, comfortable for everyday wear, great step-in feel, improved foam from v13.","Who should not buy: The GT 1000 14 is not a good fit for runners training in warm climates because the upper lacks airflow and traps heat, and it also falls short for runners after a bounce-filled ride because the EVA-based FF Blast midsole lacks responsiveness. Cons: Bad breathability, still lacks energy return, boring ride."
ASICS GT 1000 9,https://runrepeat.com/asics-gt-1000-9,"Who should buy: The GT 1000 9 is perfect if you're looking for a reasonably priced stability shoe that offers some nice features and a premium build quality, with a fair amount of cushioning and average drop, making it a great all-around road runner for easier runs. Pros: Great grip, decent cushioning, excellent stability shoe for over-pronators, durable, fits true to size, arch support.","Who should not buy: Don’t buy the GT 1000 9 if you are covering serious miles, planning to bring it on race day, or if you don’t over-pronate and would be better served by a neutral shoe. Cons: details not fully captured on the page excerpt for this pass."
ASICS GT 2000 10,https://runrepeat.com/asics-gt-2000-10,"Who should buy: The GT 2000 10 is ideal for runners on a budget or newer runners who need some arch or stability support. It is comfortable, responsive, and won’t take any time to break in or get used to, and it is a classic do-it-all type of training shoe that can fit a lot of different needs for a wide variety of runners. Pros: Lightweight stability shoe, responsive ride, comfortable, wide toe box, good lockdown, durable outsole, price.","Who should not buy: This shoe is not for runners who want a higher-performing stability shoe, who don’t need stability control shoes, or who want a fast race day shoe. Cons: Overly padded tongue, thick ankle collar, runs warm, feels a touch long."
ASICS GT 2000 11,https://runrepeat.com/asics-gt-2000-11,"Who should buy: The ASICS GT 2000 11 is an excellent choice for those who are looking for daily running shoes that are both supportive and comfortable, runners who need a daily trainer that’s both lightweight and responsive, and fans of the Cumulus 24 who have low arches or flat feet. Pros: A gentle stability shoe; well-cushioned; comfortable in-shoe feel; responsive ride; light for its kind; secure lockdown; breathable; great value for money.","Who should not buy: This might be a pass for runners with severe overpronation; we found it better to consider the ASICS Gel Kayano 30 instead, and for those who need just a touch of stability, the neutral ASICS Gel Nimbus 24 is our recommended option. Cons: Narrower-than-expected toebox; overly padded tongue."
ASICS GT 2000 12,https://runrepeat.com/asics-gt-2000-12,"Who should buy: We think the ASICS GT 2000 12 is an excellent pick for runners looking for a reliable daily trainer with a touch of stability support, particularly appealing to women who generally pronate a bit more than men, those seeking a versatile, not overly stacked shoe that does a great job in short and long runs and delivers consistent performance, and anyone in need of a comfortable, supportive shoe that offers a well-rounded experience at a great value. Pros: Stable yet non-intrusive; built for endurance on long runs; lightest model in its series; top-notch comfort; FF Blast+ cushioning for the first time in a GT 2000; PureGel technology for heel strikers; remarkable durability of the outsole; great value at $140.","Who should not buy: If you're on the hunt for the ultimate performance daily trainer, the GT 2000 12 might fall slightly short, and it might not be the ideal pick for running on the hottest summer days due to its somewhat limited ventilation. Cons: Breathability could be improved; might require a brief break-in period; FF Blast+ lacks energy return; inconsistent traction."
ASICS GT 2000 13,https://runrepeat.com/asics-gt-2000-13,"Who should buy: We've thoroughly tested the ASICS GT 2000 13 and we think it's a superb daily trainer for those with moderate stability issues seeking subtle support to align their stride without feeling restricted, loyal fans of the GT 2000 series who buy each version because this one feels familiar but better, and runners in need of a cushioned, durable, and stable daily trainer that’s built to last and is priced well below the Gel Kayano 31. Pros: Exceptionally durable; reliable; lighter than v12; heel-striker optimized; superior stability; can handle walking too; all-around comfort; Ortholite plush insole; optimized traction.","Who should not buy: In our view, the GT 2000 13 may not be the best option for forefoot strikers due to its high drop and the PureGEL technology in the heel, and it lacks the fun factor some runners seek. Cons: Not for speedy runs; insufficiently padded tongue; upper lacks vertical room."
ASICS GT 2000 14,https://runrepeat.com/asics-gt-2000-14,"Who should buy: In our view, the ASICS GT 2000 14 is a strong option if you have narrow feet and want a daily trainer that feels stable with every step, disliked the flat feel of FF Blast+ in earlier GT 2000 versions since the new FF Blast Max offers a better underfoot experience, or need a shoe that provides a supportive ride, excellent outsole durability plus versatility for everyday use. Pros: Improved FF Blast Max foam; outstanding outsole durability; stable design without feeling intrusive; reasonable weight; same price maintained despite upgrades; well-crafted, supportive upper; new outsole design improves flexibility; dependable traction.","Who should not buy: We think the ASICS GT 2000 14 is not the best option for heavier runners or those who crave maximum underfoot cushioning, and the tapered toebox could be a limiting factor for those who need extra room for toe splay. Cons: Limited breathability; tapered toebox may feel restrictive; still lacks a truly energetic ride; PureGEL doesn't add much value."
ASICS Jolt 4,https://runrepeat.com/asics-jolt-4,"Who should buy: We recommend the ASICS Jolt 4 as an excellent training companion for beginner runners looking for a neutral shoe that's also good for walking and gym days, heavyset runners or those with mild overpronation who need more firm cushioning for a stable yet protective ride, runners in warm climates that need a comfy and breathable shoe, and those in the market for a wallet-friendly and durable daily trainer that can tackle easy runs. Pros: Extremely breathable; flexible and forgiving; feels stable underfoot; durable outsole; performs consistently in the cold; works well for walking or gym days; budget-friendly.","Who should not buy: We found the Jolt 4's EVA midsole to be decidedly firm, so those who prefer softer cushioning from their daily trainers will be better served elsewhere, and it also lacks the responsiveness to facilitate fast-paced runs. Cons: Could be lighter; cushioning on the firm side; not responsive enough."
ASICS Magic Speed,https://runrepeat.com/asics-magic-speed,"Who should buy: This shoe focuses on customers exploring plated options for the first time, racers who want a speed-day shoe to pair with their MetaSpeed Skys, or runners who just want one shoe they can train and race in without the fuss of maintaining a shoe lineup. I recommend buying the Magic Speed if you like a firmer ride underfoot, not a lot of padding in the upper, and a little extra pop off your toes. Pros: Lightweight; affordable at $150; fast and nimble; smooth transitions; peppy toe-off; minimally padded; breathable; great grip.",Who should not buy: Don’t buy this shoe if you are looking for a plush daily trainer with a soft ride or a maximalist shoe for recovery days; this is not the right shoe for someone looking to trod along at a gentle pace. Cons: Not for wide feet; not built for comfort.
ASICS Magic Speed 2,https://runrepeat.com/asics-magic-speed-2,"Who should buy: The second iteration of the ASICS Magic Speed should be on your list of to-buys if you're looking for a shoe that can handle tempo runs, workout days, and even some races. Pros: Snappy kind of fast; unbothersome plate; velvety smooth transitions; secure when cornering; roomy toe box; tongue stays in place; not a bank breaker; grips on wet roads.","Who should not buy: The Magic Speed 2 is not perfect, and if a tippy-feeling heel is a deal breaker for you or if you want a bouncy ride, this ain't it. Cons: Heel feels tippy; it won't bounce you to your next step."
ASICS Magic Speed 3,https://runrepeat.com/asics-magic-speed-3,"Who should buy: We believe the ASICS Magic Speed 3 is an excellent choice for runners seeking a similar experience to the ASICS Metaspeed Sky+/Edge+ but at a more affordable price point, anyone searching for a feather-light shoe focused on tempo runs or faster paces, and those exploring their first carbon-plated shoe and aiming to spend the least amount possible. Pros: Perfectly balanced midsole; ample cushioning for extended runs; highly breathable monomesh upper; attractively priced; exceptionally lightweight; grippy and long-lasting outsole; great deal at $160 for a carbon-plated shoe.","Who should not buy: The Magic Speed 3 may not be suitable for every runner; for those chasing peak performance, a carbon plate alone isn't enough because FF Blast+ doesn't quite make that cut, and it might not be the best fit for runners with wide feet due to its very narrow midfoot. Cons: Likely too narrow for some; midsole could use more energy return; upper could be more durable; needs better energy return."
ASICS Magic Speed 4,https://runrepeat.com/asics-magic-speed-4,"Who should buy: We've tested the Magic Speed 4 in the lab and highly recommend it for those seeking the dynamic feel of a carbon-plated shoe without the high cost, runners wanting a resilient training partner to the more expensive Metaspeed series from ASICS, and heavyweight heel strikers with a neutral footstrike who want superior cushioning. Pros: Enhanced midsole; exceptional grip; superior durability; awesome traction; excellent value for a supertrainer; colossal cushioning; carbon plate; ideal for marathon-paced workouts; fantastic upper.","Who should not buy: While the Magic Speed 4 incorporates a carbon plate, its lack of a full-length superfoam and a lighter construction significantly diminish its appeal for those seeking top-tier performance, and its less-than-ideal support could pose challenges for runners who prefer a stable ride. Cons: Limited stability; low bounce; narrow fit."
ASICS Magic Speed 5,https://runrepeat.com/asics-magic-speed-5,"Who should buy: The ASICS Magic Speed 5 is a full reset that now suits beginners who want their first carbon-plated shoe that also works well for intervals and faster training days, runners looking for a lightweight, agile, and fun shoe at a more approachable price than most competition shoes, and fans of the Magic Speed 3 who were let down by version 4 and want a clear return to a lighter, more responsive feel. Pros: Feels like a Magic Speed again; full-length FF Leap foam; excellent ASICSGRIP traction score; outstanding breathability; nimble, race-inspired geometry; reasonable price; solid competition shoe for beginners; more flexible than super shoes; excellent lacing system.","Who should not buy: While the lower price of the Magic Speed 5 may look appealing, we think it’s not the best option for serious racers, and runners who enjoy a sky-high, maximalist feel may feel underwhelmed here. Cons: Energy return limited by FF Blast+; maybe too extreme for heel strikers; not appealing for serious runners."
ASICS Megablast,https://runrepeat.com/asics-megablast,"Who should buy: Based on our lab tests, the ASICS Megablast is a great choice for runners seeking one shoe that can handle everything from daily training to interval sessions and races, those who love the unique feel of super shoe foams but prefer a plate-free ride, fans of the Superblast series who wanted something even lighter and more responsive, and marathoners seeking a super trainer built for long runs and tempo workouts that offers outstanding energy return and shock absorption. Pros: Outstanding energy return, exceptional impact protection, durable grippy outsole rubber, astonishingly low weight, performs at any pace and distance, breathable lightweight upper, high-quality materials from heel to toe, suitable for all footstrikes, top performance without a carbon plate.","Who should not buy: We think the ASICS Megablast carries a sky-high price that’s hard to justify for many runners; you can get comparable performance for much less with the Adidas Adizero EVO SL, or go for the ASICS Novablast 5 if energy return isn’t your main concern. We also found that the Megablast’s stiffness might be a drawback for those who enjoy a more flexible, forgiving ride, and the Saucony Endorphin Speed 5 is a fantastic alternative offering excellent energy return, better flexibility, and a cheaper price. Cons: Extremely expensive for a training shoe, limited outsole coverage, poor toebox durability."
ASICS Metafuji Trail,https://runrepeat.com/asics-metafuji-trail,"Who should buy: We tested the Metafuji Trail both in our lab and on trails, just to find that it’s ideal for runners who loved the Metaspeed Sky+ but want that design adapted for trail running, works exceptionally well for neutral runners tackling trail races or ultras on moderate terrain, and feels like a perfect option for those seeking a fast trail shoe with a high heel-to-toe drop. Pros: Exceptional shock absorption, amazing ASICSGRIP outsole, high-end build quality, ideal for narrow feet, lightweight for a trail shoe, fast-rolling forefoot rocker, ideal for easy flat-ish ultras, outstanding upper with top ventilation, record-breaking stack height.","Who should not buy: We believe the Metafuji Trail doesn’t justify its high price considering its good-but-not-great energy return, with FF Blast+ holding it back from true super shoe performance, and we recommend the HOKA Tecton X 3 or Adidas Terrex Agravic Speed Ultra instead. We also think the snug race-tight fit can be problematic because the toebox was restrictive in both width and height; for more room, the Nike Ultrafly or Kailas Fuga EX Pro fit better. Cons: FF Blast+ foam limits energy return, expensive, minimal stability, delicate upper prone to tearing."
ASICS Metaspeed Edge,https://runrepeat.com/asics-metaspeed-edge,"Who should buy: Buy the ASICS Metaspeed Edge if you are a 5K, 10K, or half-marathon racer that demands the lightest shoe on the market, or if you are a cadence runner who speeds up your legs at faster speeds rather than taking longer strides. Pros: Fast fast fast, insanely lightweight, breathable, great lockdown, grippy outsole, grippy laces.","Who should not buy: I don’t think buying this shoe is a good idea if you’re struggling to make your rent payment because it’s a doozy at $250, if you are a stride runner who elongates your stride to go faster and should choose the Metaspeed Sky instead, if you want a bouncy energetic race shoe because this is stiff and stable, or if you don’t really need a carbon-plated shoe and could get the ASICS Magic Speed at a much lower price point. Cons: Spendy, stiff underfoot, durability."
ASICS Metaspeed Edge Tokyo,https://runrepeat.com/asics-metaspeed-edge-tokyo,"Who should buy: The ASICS Metaspeed Edge Tokyo is a remarkable step forward and a smart choice for heel strikers who find the Sky series unstable and want smoother heel-to-toe transitions, those seeking a more traditional super shoe with a curved carbon plate and excellent grip, Vaporfly fans looking for even lighter weight, a better upper and more shock absorption, and neutral-gait runners needing a versatile super shoe that’s explosive for a 5K yet cushioned enough for a marathon. Pros: Light as a feather, excels at any distance from 5K to the marathon, elite-level traction, new FF Leap midsole is super responsive, more stable than the Metaspeed Sky Tokyo, plush forefoot, excellent upper, classic rolling feel from curved plate, better than Metaspeed Edge Paris in every way.","Who should not buy: The Metaspeed Edge Tokyo may feel too unstable for marathoners seeking control and an easy ride, and for those runners the Adidas Adizero Adios Pro 4 or Nike Alphafly 3 are much better picks. Another drawback is the rising price tag, and the Saucony Endorphin Pro 4 offers a more affordable alternative without losing the essence of a fast super shoe. Cons: Price increase, narrow fit, not stable."
ASICS Metaspeed Edge+,https://runrepeat.com/asics-metaspeed-edge-plus,"Who should buy: The Metaspeed Edge+ from ASICS is a great buy for runners who want a carbon-plated running shoe that can eat up marathon distances, or a responsive and lightweight racing flat that’s ready for tempo training and competitions. Pros: Speedy all the way, more cushioned for long miles, buttery smooth transitions, protective underfoot, hell of a snappy toe-off, super light, very breathable, nails the race-ready fit, slip-free lockdown, more durable than most racers, grips on dirt roads.","Who should not buy: To trim down weight as much as possible, the ASICS Metaspeed Edge+’s upper is very very thin, which makes it scratchy, so if you want comfort to the max without added weight you might want the OG ASICS Metaspeed Sky. And with its $250 price tag, there’s no denying that the Metaspeed Edge+ is on the pricier side; if you want to save a few more bucks, stick with the older Metaspeed Edge. Cons: Scratchy upper, not for short runs, expensive."
ASICS Metaspeed Ray,https://runrepeat.com/asics-metaspeed-ray,"Who should buy: We pushed the ASICS Metaspeed Ray to its limits and found it’s a perfect choice for runners seeking a blend of speed, lightness, and plush ride in a racing shoe, forefoot and midfoot strikers chasing every second in 5K, 10K, half marathon and marathon races, those interested in the Adidas Adizero Adios Pro Evo series but turned off by the price, and marathoners who prefer a more flexible super shoe with a rare mix of flexibility and high performance. Pros: Unbelievable low weight, exceptional energy return from FF Leap, ultra-plush cushioned ride, less stiff than most supershoes, ideal for the marathon distance, excellent traction, well-designed forefoot rocker, not expensive for a true hypershoe, comfortable heel collar.","Who should not buy: We think the Metaspeed Ray is not the best option for runners who dislike unstable rides because its full-length FF Leap midsole and compact dimensions make it extremely wobbly; for similar performance in a more stable package, the ASICS Metaspeed Sky Tokyo is a far better choice. Additionally, we do not recommend the Ray for heel strikers, as it simply doesn’t work for that running style, and the Saucony Endorphin Pro 4 or Nike Alphafly 3 are better options. Cons: Extremely unstable underfoot, not for heel strikers, aggressively tapered toebox, lacks the snap of a full-length carbon plate."
ASICS Metaspeed Sky,https://runrepeat.com/asics-metaspeed-sky,"Who should buy: The MetaSpeed Sky is ideal for the runner who has a slightly wider foot, is looking for top-of-the-line technology for race day, wants to lengthen their stride when running fast rather than speeding up their cadence, and demands not only speed but comfort, fit, breathability, and grip to carry them long distances at speed. Pros: Bouncy and responsive, fast, fantastic grip, ultra breathable, stable even at slower speeds, ultra-lightweight, perfect fit, superb foot lockdown, fits wider feet.","Who should not buy: This shoe is not for the thrifty, at $250, and if you’re not an ASICS fan you may prefer the Nike Vaporfly Next% 2 or the New Balance RC Elite v2 instead. Cons: Not so durable, expensive, not for cold weather, no heel tab."
