shoe_name,url,positive_text,negative_text
Mizuno Wave Sky 9,https://runrepeat.com/mizuno-wave-sky-9,"Who should buy: neutral runners seeking a premium plush daily trainer with better traction and airflow than the previous version, especially long-run fans. Pros: premium-level shock absorption, a soft midsole, outstanding overall comfort, strong wet-surface grip, a high-quality upper, high breathability, and a ride that works especially well for forefoot and midfoot strikers.","Who should not buy: runners expecting strong rebound from a pricey daily trainer. Cons: it feels overpriced, energy return is downgraded, and the midsole is stiffer than expected for this category."
Mount to Coast H1,https://runrepeat.com/mount-to-coast-h-1,"Who should buy: runners wanting a lesser-known gravel and road-to-trail option that can also serve as a one-shoe travel companion. Pros: excellent on gravel, good mixed-terrain grip, very light for a trail shoe, premium-feeling upper, innovative lacing, stable ride, balanced cushioning with decent bounce, sustainable foam, and a fair price.","Who should not buy: runners chasing max-stack cushioning or a roomier forefoot. Cons: the toebox is tapered, outsole and toebox durability raise concerns, and the thin outsole may limit longevity."
New Balance 1080 v15,https://runrepeat.com/new-balance-1080-v-15,"Who should buy: neutral runners who want a plush premium daily trainer for long easy miles, especially longtime 1080 fans. Pros: exceptional plush comfort, an upgraded foam, reduced weight, dependable fit with multiple widths, reliable traction, better ability at faster paces, flexible agile feel, premium breathable knit upper, and excellent reflective details.","Who should not buy: runners who prefer a more balanced controlled ride. Cons: the price is slightly higher, the ultra-plush foam will not suit everyone, and overall stability is limited."
New Balance 510 v6,https://runrepeat.com/new-balance-510-v-6,"Who should buy: trail novices wanting a budget-friendly door-to-trail shoe that can also handle walking and light hiking. Pros: works well as a road-to-trail option, affordable price, beginner-friendly nature, good impact protection, a cushy padded upper, solid traction on and off road, breathable yet protective toebox, and strong arch support.","Who should not buy: runners heading onto technical or rocky trails. Cons: it is not built for technical terrain, lacks a real rock plate, and the midsole feels dull."
New Balance DynaSoft Nitrel v5,https://runrepeat.com/new-balance-dynasoft-nitrel-v5,"Who should buy: budget-minded runners wanting an easy-trail hybrid that can also handle walking, hiking, travel, and road sections. Pros: unbeatable price, solid road-to-light-trail versatility, comfortable ride for daily runs, suitable for various distances, surprisingly light weight, decent stability, and a breathable upper.","Who should not buy: runners planning longer runs or wet-surface use. Cons: upper durability is poor, energy return is limited, traction on wet ground is weak, and cushioning is modest for longer outings."
New Balance DynaSoft Nitrel v6,https://runrepeat.com/new-balance-dynasoft-nitrel-v6,"Who should buy: budget-minded midfoot and forefoot strikers wanting a stable low-to-the-ground trail shoe that can also work for hiking, walking, and travel. Pros: comfortable enough for all-day wear, superb stability, strong value, improved durability, better breathability, good one-shoe travel utility, hiking and walking versatility, and a natural low-profile feel.","Who should not buy: heel strikers, heavier runners, or anyone wanting more underfoot protection. Cons: cushioning is limited, the outsole needs improvement, the shoe gained weight, and the low-drop setup does not work well for heel-first landings."
New Balance Fresh Foam 1080 v11,https://runrepeat.com/new-balance-fresh-foam-1080-v-11,"Who should buy: runners who prioritize comfort above all in a daily trainer and want a light well-gripping shoe. Pros: extremely comfortable feel, foot-hugging fit, superb breathability, a tongue that stays put, flawless grip, and low weight.","Who should not buy: runners needing a more stable or performance-oriented ride. Cons: the upper is too flexible, the platform feels wobbly, and sharp or quick turns require caution."
New Balance Fresh Foam 680 v8,https://runrepeat.com/new-balance-fresh-foam-680-v8,"Who should buy: beginners or weekend runners wanting an affordable plush daily trainer that also works for everyday wear and recovery mileage. Pros: highly breathable upper, exceptional durability, outstanding value, strong weight-to-cushioning ratio, comfortable tongue, compatibility with all footstrikes, daily-wear readiness, Fresh Foam cushioning, and an effective lacing system.",Who should not buy: speed-focused runners or anyone needing stability features. Cons: it is not suitable for speedwork and works best only for neutral runners.
New Balance Fresh Foam 860 v11,https://runrepeat.com/new-balance-fresh-foam-860-v11,"Who should buy: overpronators wanting a dependable cushioned stability daily trainer for longer mileage. Pros: excellent stability, comfortable fit, good lacing, good grip, consistent ride in any condition, appealing design, and strong daily-run utility.","Who should not buy: neutral runners or anyone shopping for speed. Cons: it is heavy, runs slightly narrow and may require going up half a size, and it is definitely not a racing shoe."
New Balance Fresh Foam 860 v12,https://runrepeat.com/new-balance-fresh-foam-860-v-12,"Who should buy: overpronators wanting a traditional supportive daily trainer for recovery and slower-paced mileage. Pros: excellent stability, comfortable ride, dependable grip, classic reliable lacing, consistent all-condition feel, improved fit over v11, and strong daily-run performance.","Who should not buy: neutral runners or anyone wanting a fast lightweight shoe. Cons: it runs half a size small, the heel counter will not suit everyone, and it is quite heavy."
New Balance Fresh Foam Arishi v4,https://runrepeat.com/new-balance-fresh-foam-arishi-v4,"Who should buy: casual runners and fitness-focused users wanting a lightweight neutral trainer for easy runs, gym sessions, walks, and all-day wear. Pros: cloud-like cushioning, a pleasant bounce, extreme flexibility, low weight, comfort for easy or recovery runs, all-day wearability, and minimal break-in time.","Who should not buy: runners aiming for longer or faster runs, or anyone needing more support or width. Cons: it lacks arch support, the heel can rub, the upper feels stiff, and the fit is not ideal for wide feet."
New Balance Fresh Foam Hierro v6,https://runrepeat.com/new-balance-fresh-foam-hierro-v-6,"Who should buy: trail runners wanting a plush comfortable protective shoe for dry rocky trails and moderate terrain. Pros: highly cushioned and protective underfoot, well-padded comfortable upper, and a good entry point into moderate trail running.","Who should not buy: runners tackling very technical terrain or anyone who wants strong ground feel. Cons: the lug pattern is modest and not built for technical or off-trail use, and the high foam stack mutes trail feel."
New Balance Fresh Foam More v3,https://runrepeat.com/new-balance-fresh-foam-more-v-3,"Who should buy: runners shopping for a max-cushioned long-run or recovery-day shoe, especially those considering HOKA-style plush trainers. Pros: insanely soft underfoot, efficient stride, true-to-size fit, wide-foot friendliness, stable platform, strong durability potential, max cushioning, no break-in period, and good lockdown.","Who should not buy: runners in hot climates or those needing strong grip on loose terrain. Cons: it runs warm, feels somewhat heavy, and traction is subpar off clean surfaces."
New Balance Fresh Foam Roav V2,https://runrepeat.com/new-balance-fresh-foam-roav-v2,"Who should buy: entry-level runners and heel strikers wanting an affordable lightweight shoe that also works for gym sessions and everyday use. Pros: very light weight, high-quality materials, strong running-to-gym versatility, wallet-friendly price, plenty of color choices, casual-wear appeal, awesome traction, and a heel-striker-friendly setup.",Who should not buy: wide-footed runners or anyone prioritizing long-term durability over price. Cons: the fit is too narrow for wide feet and outsole durability is not great.
New Balance Fresh Foam X 1080 v12,https://runrepeat.com/new-balance-fresh-foam-x-1080-v-12,"Who should buy: runners wanting a highly cushioned daily trainer for long road miles and easy-to-moderate days, especially those with wider feet. Pros: smooth transitions, stable cornering, comfortable upper, roomy fit, no lace bite, great heel hold, and an eye-catching design.","Who should not buy: narrow-footed runners or anyone wanting a lighter true speed shoe. Cons: the fit is not ideal for narrow feet, the shoe feels bottom-heavy at faster paces, and breathability is questionable."
New Balance Fresh Foam X 1080 v13,https://runrepeat.com/new-balance-fresh-foam-x-1080-v-13,"Who should buy: neutral runners and beginners who crave maximum softness and premium comfort in a trustworthy daily trainer. Pros: exceptional comfort, outstanding breathability, incredibly soft ride, durable outsole, lightweight build for its size, high-quality materials, relaxed long-run ability, fit that suits many foot shapes, and excellent grip.","Who should not buy: runners wanting a lively or especially stable ride. Cons: the EVA-based midsole lacks strong energy return, stability is limited, and the shoe is not suited to quick-paced running."
New Balance Fresh Foam X 1080 v14,https://runrepeat.com/new-balance-fresh-foam-x-1080-v14,"Who should buy: runners who value top-tier comfort and durability in a plush recovery-oriented daily trainer, especially marathoners wanting a soft post-workout shoe. Pros: amazing step-in feel, excellent durability, cloud-soft midsole, strong comfort for forefoot and midfoot strikers, airy upper, improved stability, and fair pricing for a premium daily trainer.","Who should not buy: runners wanting a lighter or more energetic ride. Cons: weight increased noticeably, the toebox is tapered, the midsole may be too soft for some, and energy return is lacking."
New Balance Fresh Foam X 860 v14,https://runrepeat.com/new-balance-fresh-foam-x-860-v14,"Who should buy: runners with moderate stability needs who want a cushioned supportive daily trainer that can double as a walking shoe. Pros: innovative dual-layer midsole, comfort for short and mid-distance runs, heel-striker-friendly design, casual-use comfort, good value, reliable daily-mile performance, generous outsole coverage, superb lockdown, and reflective details.","Who should not buy: runners who prefer a simpler more predictable stability setup. Cons: breathability is limited, upper durability is lacking, the shoe could be lighter, and the design may feel overly complex."
New Balance Fresh Foam X 880 v14,https://runrepeat.com/new-balance-fresh-foam-x-880-v-14,"Who should buy: runners wanting a dependable neutral daily trainer with a soft midsole and a roomy knit upper, especially if they considered the 1080 but want to spend less. Pros: great fit with a gusseted tongue, accommodating shape for wider feet, fair price, soft comfortable knit upper, lighter weight than the previous version, plush midsole, generous outsole coverage, and availability in multiple widths.",Who should not buy: runners seeking a more premium highly cushioned experience or better climate consistency. Cons: airflow is limited and the midsole gets firmer in winter.
New Balance Fresh Foam X 880 v14 GTX,https://runrepeat.com/new-balance-fresh-foam-x-880-v14-gtx,"Who should buy: runners who like New Balance daily trainers and want a winter-ready waterproof version for relaxed runs, errands, and cold-weather training. Pros: winter-ready design, cozy all-day-comfort upper, stable ride, durable construction, soft midsole for long distances, light weight for a GTX shoe, reliable wet-surface traction, and reflective details.","Who should not buy: budget-conscious runners or anyone expecting a roomier waterproof fit. Cons: the price jumps sharply versus the standard version, the Gore-Tex integration could be better, and the toebox is narrower than expected."
New Balance Fresh Foam X 880 v15,https://runrepeat.com/new-balance-fresh-foam-x-880-v-15,"Who should buy: neutral runners who wanted more cushioning than older 880 models or want near-1080 stack height at a lower price. Pros: affordable max-stack setup, secure and comfortable lockdown, rockered geometry, plush tongue, zero heel slippage, strong long-run comfort, durable comfy upper, fair price, and a stable ride.","Who should not buy: longtime 880 fans who preferred the grounded moderate-stack feel, or anyone hard on outsoles. Cons: it is much heavier than before, not great for walking or casual wear, Fresh Foam X feels firmer than expected, and outsole durability is now a concern."
New Balance Fresh Foam X Balos,https://runrepeat.com/new-balance-fresh-foam-x-balos,"Who should buy: runners wanting a super-plush lightweight daily trainer for easy miles, long runs, and recovery days, especially midfoot strikers and fans of the old Invincible or 1080 line. Pros: cloud-like cushioning, amazing rocker, low weight for its size, breathable moisture-wicking upper, long-run and recovery comfort, usable walking versatility, fantastic knit tongue, midfoot-striker friendliness, and full reflectivity.","Who should not buy: runners sensitive to price or needing more room and rebound. Cons: the toebox is low-volume, the price feels excessive, energy return is underwhelming, and the EVA outsole raises durability concerns."
New Balance Fresh Foam X Evoz v3,https://runrepeat.com/new-balance-fresh-foam-x-evoz-v3,"Who should buy: runners who want a lightweight affordable daily trainer that can also handle walking and everyday wear. Pros: lightweight build, exceptional value, durable outsole, strong cold-weather performance, secure gusseted tongue, solid running-and-walking versatility, all-day comfort, good cushioning, and confident cornering.","Who should not buy: runners in hot climates or anyone needing a wider fit. Cons: breathability is lacking, outsole coverage is reduced, and the fit is not great for wide feet."
New Balance Fresh Foam X Evoz v4,https://runrepeat.com/new-balance-fresh-foam-x-evoz-v-4,"Who should buy: value-focused runners wanting a stable dependable daily trainer for short to medium distances, especially midfoot and forefoot strikers. Pros: excellent price, surprisingly stable underfoot, breathable premium-feel upper, semi-gusseted tongue for lockdown, strong step-in comfort, and standout value under $100.","Who should not buy: heel strikers or runners wanting a plush bouncy ride or wider fit. Cons: the lower drop will not suit everyone, the shoe is heavier and stiffer than v3, the fit is not wide-foot friendly, and grip disappoints on slick surfaces."
New Balance Fresh Foam X Garoe v2,https://runrepeat.com/new-balance-fresh-foam-x-garoe-v-2,"Who should buy: beginner trail runners who want solid cushioning and a heel-striker-friendly geometry for light trail adventures. Pros: strong cushioning and shock absorption, comfortable supportive upper, good energy return for the price, lightweight feel for its size, excellent value, hiking and daily-wear versatility, trail-ready design, and plush foam.","Who should not buy: runners who prefer a moderate drop or a roomier more flexible feel. Cons: the drop is very high, the ride feels somewhat stiff, the toebox runs tight, and stability is only moderate."
New Balance Fresh Foam X Hierro v7,https://runrepeat.com/new-balance-fresh-foam-hierro-v-7,"Who should buy: trail runners wanting a grippy durable do-it-all shoe, especially those upgrading from earlier Hierro versions and long-distance runners wanting a lighter update. Pros: grippier than ever, built for rough use, lighter than past models, smooth heel-to-toe transitions, stable cornering, buttery-soft ride, wide-foot accommodation, secure tongue, and hiking versatility.",Who should not buy: runners who need more forefoot cushioning or better summer ventilation. Cons: airflow is limited and the forefoot lacks enough cushion for some.
New Balance Fresh Foam X Hierro v8,https://runrepeat.com/new-balance-fresh-foam-x-hierro-v-8,"Who should buy: comfort-first trail runners and beginners looking for a flexible versatile first trail shoe that can also hike well. Pros: exceptionally plush ride, very soft Fresh Foam X, remarkable flexibility, reasonable price, strong winter performance, sustainable touches, reliable grip on moderate trails, and good hiking utility.","Who should not buy: runners seeking a lighter, better-ventilated shoe for technical trails. Cons: ventilation is poor, the non-gusseted tongue is problematic, durability in the toebox and heel is concerning, and the shoe is not suited for technical terrain."
New Balance Fresh Foam X Hierro v9,https://runrepeat.com/new-balance-fresh-foam-x-hierro-v9,"Who should buy: Hierro fans who wanted much more cushioning, plus trail runners seeking a plush durable maximalist shoe for long distances, especially midfoot and forefoot strikers. Pros: tons of foam underfoot, Vibram Megagrip outsole, improved Fresh Foam X midsole, surprising stability, excellent durability, long-distance comfort, multiple width options, quality materials, and strong performance for forefoot and midfoot landings.","Who should not buy: runners who loved the old flexible natural-feeling Hierro or who dislike heavier low-drop shoes. Cons: the fit is not very roomy, the shoe is heavier than before, it lost its flexible nature, and the low-drop setup will not suit everyone."
New Balance Fresh Foam X Kaiha Road,https://runrepeat.com/new-balance-fresh-foam-x-kaiha-road,"Who should buy: runners wanting a budget-friendly maximal daily trainer with lots of plush foam for recovery runs, walking, and all-day comfort, including forefoot strikers and pronators who still prefer neutral shoes. Pros: marshmallow-soft cushioning, recovery-run friendliness, extreme flexibility, smooth rocker, above-average breathability, excellent cold-weather consistency, good stability, long-run comfort, and an accommodating toebox.",Who should not buy: runners shopping for a true tempo shoe. Cons: upper durability is lacking and the ride is not responsive enough for efficient speedwork.
New Balance Fresh Foam X More Trail v3,https://runrepeat.com/new-balance-fresh-foam-x-more-trail-v3,"Who should buy: trail runners wanting a max-cushioned cruiser for easy days, long runs, and ultra-distance outings with plenty of protection. Pros: incredibly protective without a rock plate, soft but not mushy cushioning, useful bounce, excellent stability, plush airy upper, good grip on mild to moderate trails, durable outsole, smooth ride, light feel on the run, and sustainable construction.","Who should not buy: runners heading onto technical trails or anyone needing more upper support or toe room. Cons: the upper could use more support, technical-terrain performance is limited, and the toebox is pointy."
New Balance Fresh Foam X More v4,https://runrepeat.com/new-balance-fresh-foam-more-v-4,"Who should buy: runners who want an extra-plush shoe for easy or long runs and care most about comfort. Pros: extremely cushy ride, some added life underfoot, stable platform, true-to-size fit, excellent heel lockdown, markdown-friendly price, long-lasting build, reflective details, and good traction.","Who should not buy: runners in hot conditions or anyone wanting a lighter more energetic feel. Cons: it gets hot easily, feels chunky and clunky, and energy return is low."
New Balance Fresh Foam X More v5,https://runrepeat.com/new-balance-fresh-foam-x-more-v5,"Who should buy: runners wanting an ultra-soft yet stable maximal shoe for slow recovery-oriented miles, especially anyone who liked the 1080 v13 but wanted even more cushion. Pros: exceptional all-around comfort, ultra-plush cushioning, ideal for slow long runs, great cushion-to-price ratio, remarkable stability for such a big shoe, superb lockdown, durable grippy outsole, well-shaped rocker, and many improvements over v4.","Who should not buy: runners who want a more responsive max-cushioned shoe or a roomier fit. Cons: it is heavier than v4, fits snug, may even feel too plush, and can be a bit stiff for casual wear."
New Balance Fresh Foam X More v6,https://runrepeat.com/new-balance-fresh-foam-x-more-v-6,"Who should buy: runners seeking an ultra-soft daily trainer or recovery shoe with huge shock absorption and decent flexibility. Pros: record-breaking shock absorption, stable wide platform, super-plush foam, improved energy return, cozy upper, no price increase, forefoot-striker-friendly design, solid durability, secure semi-gusseted tongue, and good torsional flexibility for its size.","Who should not buy: runners who dislike heavy shoes or ultra-plush midsoles. Cons: the fit is narrow and low-volume, the shoe is still heavy, airflow is weak, and the low drop will not work for everyone."
New Balance Fresh Foam X Tempo v2,https://runrepeat.com/new-balance-fresh-foam-x-tempo-v-2,"Who should buy: runners who like lower-stack ground-feel shoes and want an affordable trainer that can handle daily miles and tempo workouts. Pros: incredible value, versatility across slow and faster runs, secure lockdown from the gusseted tongue, flexible natural ride, plush midsole, foot-strength-friendly design, fantastic knit upper, good option for lightweight runners, smooth transitions, and solid durability.","Who should not buy: runners wanting high cushioning, more stability, or a roomier fit. Cons: it is not ideal for long-distance training, lacks stability, feels a bit heavy for its stack, and works best for low-volume feet."
New Balance Fresh Foam X Vongo v6,https://runrepeat.com/new-balance-fresh-foam-x-vongo-v-6,"Who should buy: mild pronators seeking a cushioned supportive shoe for easy and long runs, especially fans of the 1080 who want more support and forefoot or midfoot strikers who need durability. Pros: flexible design, comfortable high-quality upper, exceptional durability, easy-pace comfort, neutral-runner compatibility, long-run capability, and reasonable pricing.","Who should not buy: heel strikers, weight-conscious runners, or loyalists wanting the older Vongo feel. Cons: it is noticeably heavy, breathability is limited, the ride is not ideal for heel strikers, and the new plated setup may not please fans of previous versions."
New Balance FuelCell Propel v4,https://runrepeat.com/new-balance-fuelcell-propel-v4,"Who should buy: midfoot and forefoot strikers wanting a budget-friendly plated trainer that can handle easy miles and tempo runs. Pros: high-quality upper, ultra-cushioned FuelCell midsole, well-integrated TPU plate, versatility across paces, long-lasting outsole, strong value at $110, and grippy traction.",Who should not buy: heel strikers or runners who want a firmer more stable ride. Cons: it is not the best for heel-first landings and overall stability can be a concern.
New Balance FuelCell Propel v5,https://runrepeat.com/new-balance-fuelcell-propel-v5,"Who should buy: runners seeking a plush affordable do-it-all shoe for daily runs, long runs, and uptempo sessions, especially midfoot strikers. Pros: exceptionally plush FuelCell midsole, highly breathable upper, stability-focused TPU plate, tempo capability, daily-wear usefulness, lower weight than before, and strong value versus similar models.","Who should not buy: runners concerned about durability or heel strikers wanting a better geometry match. Cons: durability is poor, the shoe is not ideal for heel strikers, and the outsole tends to trap small rocks."
New Balance FuelCell RC Elite v2,https://runrepeat.com/new-balance-fuel-cell-rc-elite-v-2,"Who should buy: medium- to long-distance racers who want carbon-plated speed without giving up comfort, especially wider-footed competitors. Pros: plush comfort for a race shoe, smooth fast ride, breathable upper, responsive toe-off, carbon plate, stiffness that avoids feeling harsh, true-to-size fit, foot-hugging stretchy upper, sticky tread, and standout styling.","Who should not buy: runners who need a tempo trainer or everyday workhorse instead of a race-day shoe. Cons: it is expensive, heavier than many race shoes, the tongue tends to fold under, and durability may be insufficient for daily abuse."
New Balance FuelCell Rebel v2,https://runrepeat.com/new-balance-fuel-cell-rebel-v-2,"Who should buy: runners wanting a true do-it-all non-plated shoe that is light, soft, flexible, and surprisingly race-capable. Pros: true-to-size fit, wide-foot friendliness, very low weight, breathable upper, great lockdown, ultra-comfortable ride, excellent value, lively bounce, smooth rocker, and versatility from recovery days to tempos and even racing.","Who should not buy: pronators or runners who specifically need a plated racer or more support. Cons: it can feel slightly unstable when walking, there is no heel loop, the midsole stiffens in cold weather, and the soft platform can angle inward for runners needing more stability."
New Balance FuelCell Rebel v3,https://runrepeat.com/new-balance-fuel-cell-rebel-v-3,"Who should buy: runners wanting a super-soft, lively all-rounder that can handle almost every pace, including short and middle distances and even race day. Pros: a fantastic soft and fun ride, versatility across paces, very low weight, excellent breathability, better stability than v2, great lockdown, visibility at night, and a fair price.","Who should not buy: runners needing strong wet-surface grip or those who tend to bottom out shoes easily. Cons: poor traction on wet surfaces, durability could be better, and it bottoms out easily."
